{
  "$schema": "https://raw.githubusercontent.com/tdwg/cd/review/standard/json/json-schemas/1.0/latimer-core-schema.json",
  "$id": "https://raw.githubusercontent.com/tdwg/cd/review/standard/json/vocabulary-schemas/1.0/organisational-unit.json",
  "title": "Organisational Unit",
  "description": "A unit within an organisational hierarchy which may be at, above or below the institutional level. This class can represent any level of organisational unit, incorporating institutions (e.g. a museum), higher units (e.g. a university to which a museum belongs) and more detailed structures (e.g the departments and divisions within a museum). It can be used to arrange these different units at different levels into a hierarchical structure. This class combines aspects of both class org:Organization (https://www.w3.org/TR/2014/REC-vocab-org-20140116/#org:Organization) and class org:OrganizationalUnit (https://www.w3.org/TR/2014/REC-vocab-org-20140116/#org:OrganizationalUnit) from the W3C Organization Ontology ORG (https://www.w3.org/TR/2014/REC-vocab-org-20140116/#overview-of-ontology). Recommended best practice is to associate a unique, persistent organisational identifier (PID) with each created organisational unit. This will allow an unambiguous and continual identification of the unit, as well as the creation of organisational hierarchies. Existing providers of PIDs for organisations are, e.g. https://grid.ac/ and https://ror.org/. The provision of organisational PIDs might be extended to intra-organisational units in the future. Properties of Class: Identifier can be used to add identifier information for organisational units.",
  "type": "object",
  "properties": [
	{
			"name": "hasAddress",
			"description": "This property refers to one or more related instances of the Address class.",
			"type": "array",
			"items": {
		  "$ref": "https://raw.githubusercontent.com/tdwg/cd/review/standard/json-schema/address.json"
		},
			"minItems": 0,
			"uniqueItems": true
		},
		{
			"name": "hasContactDetail",
			"description": "This property refers to one or more related instances of the ContactDetail class.",
			"type": "array",
			"items": {
		  "$ref": "https://raw.githubusercontent.com/tdwg/cd/review/standard/json-schema/contact-detail.json"
		},
			"minItems": 0,
			"uniqueItems": true
		},
		{
			"name": "hasIdentifier",
			"description": "This property refers to one or more related instances of the Identifier class.",
			"type": "array",
			"items": {
		  "$ref": "https://raw.githubusercontent.com/tdwg/cd/review/standard/json-schema/identifier.json"
		},
			"minItems": 0,
			"uniqueItems": true
		},
		{
			"name": "hasMeasurementOrFact",
			"description": "This property refers to one or more related instances of the MeasurementOrFact class.",
			"type": "array",
			"items": {
		  "$ref": "https://raw.githubusercontent.com/tdwg/cd/review/standard/json-schema/measurement-or-fact.json"
		},
			"minItems": 0,
			"uniqueItems": true
		},
		{
			"name": "hasOrganisationalUnit",
			"description": "This property refers to one or more related instances of the OrganisationalUnit class.",
			"type": "array",
			"items": {
		  "$ref": "https://raw.githubusercontent.com/tdwg/cd/review/standard/json-schema/organisational-unit.json"
		},
			"minItems": 0,
			"uniqueItems": true
		},
		{
			"name": "hasPersonRole",
			"description": "This property refers to one or more related instances of the PersonRole class.",
			"type": "array",
			"items": {
		  "$ref": "https://raw.githubusercontent.com/tdwg/cd/review/standard/json-schema/person-role.json"
		},
			"minItems": 0,
			"uniqueItems": true
		},
		{
			"name": "hasReference",
			"description": "This property refers to one or more related instances of the Reference class.",
			"type": "array",
			"items": {
		  "$ref": "https://raw.githubusercontent.com/tdwg/cd/review/standard/json-schema/reference.json"
		},
			"minItems": 0,
			"uniqueItems": true
		},
		{
			"name": "organisationalUnitName",
			"description": "An official name of the organisational unit in the local language.",
			"type": "string"
		},
		{
			"name": "organisationalUnitType",
			"description": "The type or level of organisational unit within a hierarchy responsible for the management of the collection being described.",
			"type": "string"
    }
	],
  "required": [
    "organisationalUnitName",
    "organisationalUnitType"
  ]
}