{
  "$schema": "https://raw.githubusercontent.com/tdwg/cd/review/json-schemas-dev/standard/schemas/json/2.0/latimer-core-schema.json",
  "$id": "https://raw.githubusercontent.com/tdwg/cd/review/json-schemas-dev/standard/schemas/vocabulary/2.0/scheme-term.json",
  "title": "Scheme Term",
  "description": "A Latimer Core term used by the CollectionDescriptionScheme and the rules relating to its application. This class can be used to define which of the terms (classes and/or properties) within the standard (e.g. GeographicOrigin, Taxon, preservationMethod) are expected to be used within the scheme, and specify whether they're mandatory and/or repeatable. This information can be used by software and queries to validate the data and understand the rules by which metrics can be reported against the specified term.",
  "type": "object",
  "properties": [
	{
			"name": "hasIdentifier",
			"description": "This property refers to one or more related instances of the Identifier class.",
			"type": "array",
			"items": {
		  "$ref": "https://raw.githubusercontent.com/tdwg/cd/review/json-schemas-dev/standard/schemas/vocabulary/2.0/identifier.json"
		},
			"minItems": 0,
			"uniqueItems": true
		},
		{
			"name": "hasReference",
			"description": "This property refers to one or more related instances of the Reference class.",
			"type": "array",
			"items": {
		  "$ref": "https://raw.githubusercontent.com/tdwg/cd/review/json-schemas-dev/standard/schemas/vocabulary/2.0/reference.json"
		},
			"minItems": 0,
			"uniqueItems": true
		},
		{
			"name": "isMandatoryTerm",
			"description": "A flag to designate whether it is mandatory or optional for all ObjectGroups in the CollectionDescriptionScheme to include or be linked to valid data for the class or property defined in the termName property.",
			"type": "boolean"
		},
		{
			"name": "isRepeatableTerm",
			"description": "A flag to designate whether multiple instances of the Latimer Core class or property defined in the termName property may be attached to a single ObjectGroup.",
			"type": "boolean"
		},
		{
			"name": "termName",
			"description": "The name of a class or property within the Latimer Core standard that is included in the CollectionDescriptionScheme.",
			"type": "string"
    }
	],
  "required": [
    "isMandatoryTerm",
    "isRepeatableTerm",
    "termName"
  ]
}