{
  "$schema": "https://raw.githubusercontent.com/tdwg/cd/review/json-schemas-dev/standard/schemas/json/2.0/latimer-core-vocabulary.schema.json",
  "$id": "https://raw.githubusercontent.com/tdwg/cd/review/json-schemas-dev/standard/schemas/vocabulary/2.0/identifier.json",
  "title": "Identifier",
  "description": "A numeric, textual value, or reference such as an IRI, that can be used to uniquely identify the object to which it is attached. Use this class to document stable identifiers that describe the collections and associated entities being represented in the collection description. For example, person identifiers, taxon identifiers, institution identifiers, organisational unit identifiers, gazetteer identifiers. Identifiers represented by this class may be globally unique, or unique within a given context.",
  "type": "object",
  "properties": [
	{
			"name": "hasReference",
			"description": "This property refers to one or more related instances of the Reference class.",
			"type": "array",
			"items": {
		  "$ref": "https://raw.githubusercontent.com/tdwg/cd/review/json-schemas-dev/standard/schemas/vocabulary/2.0/reference.json"
		},
			"minItems": 0,
			"uniqueItems": true
		},
		{
			"name": "identifierSource",
			"description": "The source or creator of the identifier.",
			"type": "string"
		},
		{
			"name": "identifierType",
			"description": "The type and format of the value in the identifier field.",
			"type": "string"
		},
		{
			"name": "identifierValue",
			"description": "An unambiguous reference to the resource within a given context.",
			"type": "string"
    }
	],
  "required": [
    "identifierType",
    "identifierValue"
  ]
}