{
"$schema": "https://raw.githubusercontent.com/tdwg/cd/review/json-schemas-dev/standard/schemas/json/2.0/latimer-core-vocabulary.schema.json",
  "$id": "https://raw.githubusercontent.com/tdwg/cd/review/standard/json/vocabulary-schemas/1.0/collection-description-scheme.json",
  "title": "Collection Description Scheme",
  "description": "A grouping of multiple ObjectGroups for a particular use case, purpose or implementation. Where the same objects within the same collection might be described by more than one ObjectGroup for different purposes (for examples, a 'Darwin Fossil Mammals' collection description might overlap with a 'Offsite Palaeontology' collection description), this class can be used to distinguish between them and avoid double-counting of metrics in queries against the data.",
  "type": "object",
  "properties": [
	{
			"name": "basisOfScheme",
			"description": "A summary of the basis or purpose for the CollectionDescriptionScheme.",
			"type": "string"
		},
		{
			"name": "hasIdentifier",
			"description": "This property refers to one or more related instances of the Identifier class.",
			"type": "array",
			"items": {
		  "$ref": "https://raw.githubusercontent.com/tdwg/cd/review/standard/json-schema/identifier.json"
		},
			"minItems": 0,
			"uniqueItems": true
		},
		{
			"name": "hasObjectGroup",
			"description": "This property refers to one or more related instances of the ObjectGroup class.",
			"type": "array",
			"items": {
		  "$ref": "https://raw.githubusercontent.com/tdwg/cd/review/standard/json-schema/object-group.json"
		},
			"minItems": 0,
			"uniqueItems": true
		},
		{
			"name": "hasReference",
			"description": "This property refers to one or more related instances of the Reference class.",
			"type": "array",
			"items": {
		  "$ref": "https://raw.githubusercontent.com/tdwg/cd/review/standard/json-schema/reference.json"
		},
			"minItems": 0,
			"uniqueItems": true
		},
		{
			"name": "hasSchemeMeasurementOrFact",
			"description": "This property refers to one or more related instances of the SchemeMeasurementOrFact class.",
			"type": "array",
			"items": {
		  "$ref": "https://raw.githubusercontent.com/tdwg/cd/review/standard/json-schema/scheme-measurement-or-fact.json"
		},
			"minItems": 0,
			"uniqueItems": true
		},
		{
			"name": "hasSchemeTerm",
			"description": "This property refers to one or more related instances of the SchemeTerm class.",
			"type": "array",
			"items": {
		  "$ref": "https://raw.githubusercontent.com/tdwg/cd/review/standard/json-schema/scheme-term.json"
		},
			"minItems": 0,
			"uniqueItems": true
		},
		{
			"name": "isDistinctObjects",
			"description": "A flag to designate whether a physical object may be described by more than one ObjectGroup within the CollectionDescriptionScheme.",
			"type": "boolean"
		},
		{
			"name": "schemeName",
			"description": "A short descriptive name given to the CollectionDescriptionScheme.",
			"type": "string"
    }
	],
  "required": [
    "isDistinctObjects",
    "schemeName"
  ]
}