{
  "$schema": "https://raw.githubusercontent.com/tdwg/cd/review/json-schemas-dev/standard/schemas/json/2.0/latimer-core-vocabulary.schema.json",
  "$id": "https://raw.githubusercontent.com/tdwg/cd/review/json-schemas-dev/standard/schemas/vocabulary/2.0/record-level.json",
  "title": "Record Level",
  "description": "The machine-actionable information profile for the collection description digital object. Linked to the RDA PID Kernel recommendation (https://www.rd-alliance.org/system/files/RDA%20Recommendation%20on%20PID%20Kernel%20Information_final.pdf)",
  "type": "object",
  "properties": [
	{
			"name": "collectionDescriptionPID",
			"description": "An unambiguous reference to the collection description record.",
			"type": "string"
		},
		{
			"name": "hasIdentifier",
			"description": "This property refers to one or more related instances of the Identifier class.",
			"type": "array",
			"items": {
		  "$ref": "https://raw.githubusercontent.com/tdwg/cd/review/json-schemas-dev/standard/schemas/vocabulary/2.0/identifier.json"
		},
			"minItems": 0,
			"uniqueItems": true
		},
		{
			"name": "hasObjectGroup",
			"description": "This property refers to one or more related instances of the ObjectGroup class.",
			"type": "array",
			"items": {
		  "$ref": "https://raw.githubusercontent.com/tdwg/cd/review/json-schemas-dev/standard/schemas/vocabulary/2.0/object-group.json"
		},
			"minItems": 0,
			"uniqueItems": true
		},
		{
			"name": "hasPersonRole",
			"description": "This property refers to one or more related instances of the PersonRole class.",
			"type": "array",
			"items": {
		  "$ref": "https://raw.githubusercontent.com/tdwg/cd/review/json-schemas-dev/standard/schemas/vocabulary/2.0/person-role.json"
		},
			"minItems": 0,
			"uniqueItems": true
		},
		{
			"name": "hasReference",
			"description": "This property refers to one or more related instances of the Reference class.",
			"type": "array",
			"items": {
		  "$ref": "https://raw.githubusercontent.com/tdwg/cd/review/json-schemas-dev/standard/schemas/vocabulary/2.0/reference.json"
		},
			"minItems": 0,
			"uniqueItems": true
		},
		{
			"name": "hasResourceRelationship",
			"description": "This property refers to one or more related instances of the ResourceRelationship class.",
			"type": "array",
			"items": {
		  "$ref": "https://raw.githubusercontent.com/tdwg/cd/review/json-schemas-dev/standard/schemas/vocabulary/2.0/resource-relationship.json"
		},
			"minItems": 0,
			"uniqueItems": true
		},
		{
			"name": "isDerivedCollection",
			"description": "A flag to indicate that the collection description has been generated by aggregating data from one or more underlying datasets of its individual objects.",
			"type": "boolean"
		},
		{
			"name": "license",
			"description": "A legal document giving official permission to do something with the resource.",
			"type": "string"
		},
		{
			"name": "recordRights",
			"description": "Information about rights held in and over the resource.",
			"type": "string"
		},
		{
			"name": "rightsHolder",
			"description": "A person or organization owning or managing rights over the resource.",
			"type": "string"
    }
	],
  "required": [
    "collectionDescriptionPID",
    "license"
  ]
}