{
  "$schema": "https://raw.githubusercontent.com/tdwg/cd/review/json-schemas-dev/standard/schemas/json/2.0/latimer-core-schema.json",
  "$id": "https://raw.githubusercontent.com/tdwg/cd/review/json-schemas-dev/standard/schemas/vocabulary/2.0/object-classification.json",
  "title": "Object Classification",
  "description": "An informal classification of the type of objects within the ObjectGroup, using a hierarchical structure. This class is used to categorise the ObjectGroup according to an informal, self-referential hierarchy. For example, this can be used to create a hierarchy encompassing biological, geological and anthropological collections, where a single formal taxonomy isn't appropriate.",
  "type": "object",
  "properties": [
	{
			"name": "hasIdentifier",
			"description": "This property refers to one or more related instances of the Identifier class.",
			"type": "array",
			"items": {
		  "$ref": "https://raw.githubusercontent.com/tdwg/cd/review/json-schemas-dev/standard/schemas/vocabulary/2.0/identifier.json"
		},
			"minItems": 0,
			"uniqueItems": true
		},
		{
			"name": "hasMeasurementOrFact",
			"description": "This property refers to one or more related instances of the MeasurementOrFact class.",
			"type": "array",
			"items": {
		  "$ref": "https://raw.githubusercontent.com/tdwg/cd/review/json-schemas-dev/standard/schemas/vocabulary/2.0/measurement-or-fact.json"
		},
			"minItems": 0,
			"uniqueItems": true
		},
		{
			"name": "hasObjectClassification",
			"description": "This property refers to one or more related instances of the ObjectClassification class.",
			"type": "array",
			"items": {
		  "$ref": "https://raw.githubusercontent.com/tdwg/cd/review/json-schemas-dev/standard/schemas/vocabulary/2.0/object-classification.json"
		},
			"minItems": 0,
			"uniqueItems": true
		},
		{
			"name": "hasReference",
			"description": "This property refers to one or more related instances of the Reference class.",
			"type": "array",
			"items": {
		  "$ref": "https://raw.githubusercontent.com/tdwg/cd/review/json-schemas-dev/standard/schemas/vocabulary/2.0/reference.json"
		},
			"minItems": 0,
			"uniqueItems": true
		},
		{
			"name": "objectClassificationLevel",
			"description": "The level of the ObjectClassification in the hierarchy.",
			"type": "string"
		},
		{
			"name": "objectClassificationName",
			"description": "A short title describing this ObjectClassification as a class, unit or grouping.",
			"type": "string"
    }
	],
  "required": [
    "objectClassificationName"
  ]
}