{
  "$schema": "https://raw.githubusercontent.com/tdwg/cd/review/json-schemas-dev/standard/schemas/json/2.0/latimer-core-schema.json",
  "$id": "https://raw.githubusercontent.com/tdwg/cd/review/json-schemas-dev/standard/schemas/vocabulary/2.0/contact-detail.json",
  "title": "Contact Detail",
  "description": "Details of a method by which an entity such as a Person or OrganisationalUnit may be contacted. The Address class should be used to store physical or postal addresses. For all other types of contact details, this class should be used.",
  "type": "object",
  "properties": [
	{
			"name": "contactDetailCategory",
			"description": "The method of contact to which the contact detail applies.",
			"type": "string"
		},
		{
			"name": "contactDetailType",
			"description": "The type of contact detail, which can be used to distinguish between multiple contact details of the same contactDetailCategory.",
			"type": "string"
		},
		{
			"name": "contactDetailValue",
			"description": "The value of the contact detail, such as the phone number or email address.",
			"type": "string"
		},
		{
			"name": "hasIdentifier",
			"description": "This property refers to one or more related instances of the Identifier class.",
			"type": "array",
			"items": {
		  "$ref": "https://raw.githubusercontent.com/tdwg/cd/review/json-schemas-dev/standard/schemas/vocabulary/2.0/identifier.json"
		},
			"minItems": 0,
			"uniqueItems": true
    }
	],
  "required": [
    "contactDetailCategory",
    "contactDetailValue"
  ]
}