{
  "$schema": "https://raw.githubusercontent.com/tdwg/cd/review/json-schemas-dev/standard/schemas/json/2.0/latimer-core-schema.json",
  "$id": "https://raw.githubusercontent.com/tdwg/cd/review/json-schemas-dev/standard/schemas/vocabulary/2.0/storage-location.json",
  "title": "Storage Location",
  "description": "A physical location (such as a building, room, cabinet or drawer) within the holding institution where objects associated with the collection description are stored or exhibited.",
  "type": "object",
  "properties": [
	{
			"name": "hasAddress",
			"description": "This property refers to one or more related instances of the Address class.",
			"type": "array",
			"items": {
		  "$ref": "https://raw.githubusercontent.com/tdwg/cd/review/json-schemas-dev/standard/schemas/vocabulary/2.0/address.json"
		},
			"minItems": 0,
			"uniqueItems": true
		},
		{
			"name": "hasIdentifier",
			"description": "This property refers to one or more related instances of the Identifier class.",
			"type": "array",
			"items": {
		  "$ref": "https://raw.githubusercontent.com/tdwg/cd/review/json-schemas-dev/standard/schemas/vocabulary/2.0/identifier.json"
		},
			"minItems": 0,
			"uniqueItems": true
		},
		{
			"name": "hasMeasurementOrFact",
			"description": "This property refers to one or more related instances of the MeasurementOrFact class.",
			"type": "array",
			"items": {
		  "$ref": "https://raw.githubusercontent.com/tdwg/cd/review/json-schemas-dev/standard/schemas/vocabulary/2.0/measurement-or-fact.json"
		},
			"minItems": 0,
			"uniqueItems": true
		},
		{
			"name": "hasReference",
			"description": "This property refers to one or more related instances of the Reference class.",
			"type": "array",
			"items": {
		  "$ref": "https://raw.githubusercontent.com/tdwg/cd/review/json-schemas-dev/standard/schemas/vocabulary/2.0/reference.json"
		},
			"minItems": 0,
			"uniqueItems": true
		},
		{
			"name": "locationDescription",
			"description": "Short textual description of the storage location of the group of items",
			"type": "string"
		},
		{
			"name": "locationName",
			"description": "A label used to identify a place where the collection is stored.",
			"type": "string"
		},
		{
			"name": "locationType",
			"description": "The nature of the location where the collection is stored.",
			"type": "string"
    }
	],
  "required": [
    "locationName"
  ]
}